{"schema_version":"1.0.0","item_id":1107,"patch_version":"16.17.1","programs":[{"id":"scorchclaw_companion_variant","source_label":"PASSIVE:Jungle Companions","kind":"PASSIVE","trigger":"ATTACK_OR_ABILITY_HIT","required_context_flag":"SCORCHCLAW_FULLY_GROWN_AND_READY","operations":[{"kind":"DAMAGE","target":"TARGET","damage_type":"TRUE","context_multiplier":"SCORCHCLAW_LEVEL_BURN_DAMAGE","value_expression":{"type":"CONSTANT","value":"1"}},{"kind":"APPLY_STATUS","target":"TARGET","status_or_stat":"CC_SLOW","duration_ms":2000,"context_multiplier":"SCORCHCLAW_SLOW_MAGNITUDE","value_expression":{"type":"CONSTANT","value":"1"}},{"kind":"NO_OP","target":"SELF","status_or_stat":"JUNGLE_QUEST_PROGRESS_AND_EMPOWER_SMITE","value_expression":{"type":"CONSTANT","value":"1"}}]}],"verification":{"status":"CURATED_UNVERIFIED","source_refs":["data/raw/16.17.1/en_US/item.json#/data/1107","data/raw/16.17.1/communitydragon/items.cdtb.bin.json#/Items~1/1107"]}}
