{"schema_version":"1.0.0","item_id":1102,"patch_version":"16.17.1","programs":[{"id":"gustwalker_companion","source_label":"PASSIVE:Jungle Companions","kind":"PASSIVE","trigger":"ENTER_BRUSH","required_context_flag":"GUSTWALKER_FULLY_GROWN","operations":[{"kind":"GRANT_STAT","target":"SELF","status_or_stat":"MOVE_SPEED_PERCENT","duration_ms":2000,"context_multiplier":"GUSTWALKER_LARGE_MONSTER_KILL_MULTIPLIER","value_expression":{"type":"CONSTANT","value":"0.45"}},{"kind":"NO_OP","target":"SELF","status_or_stat":"JUNGLE_QUEST_PROGRESS_AND_EMPOWER_SMITE","value_expression":{"type":"CONSTANT","value":"1"}}]}],"verification":{"status":"CURATED_UNVERIFIED","source_refs":["data/raw/16.17.1/en_US/item.json#/data/1102","data/raw/16.17.1/communitydragon/items.cdtb.bin.json#/Items~1/1102"]}}
