{"schema_version":"1.0.0","item_id":664644,"patch_version":"16.17.1","programs":[{"id":"crown_shattered_queen_safeguard","source_label":"PASSIVE:Safeguard","kind":"PASSIVE","trigger":"OUT_OF_COMBAT","cooldown_ms":30000,"operations":[{"kind":"DAMAGE_MODIFIER","target":"SELF","value_expression":{"type":"CONSTANT","value":"0.60"},"duration_ms":3000,"status_or_stat":"CHAMPION_DAMAGE_MULTIPLIER"}]}],"verification":{"status":"CURATED_UNVERIFIED","source_refs":["data/raw/16.17.1/en_US/item.json#/data/664644","data/raw/16.17.1/communitydragon/items.cdtb.bin.json#/Items~1/664644"]}}
