{"schema_version":"1.0.0","item_id":323003,"patch_version":"16.17.1","programs":[{"id":"archangels_variant_awe","source_label":"PASSIVE:Awe","kind":"PASSIVE","trigger":"ALWAYS","operations":[{"kind":"GRANT_STAT","target":"SELF","value_expression":{"type":"MULTIPLY","factors":[{"type":"CONSTANT","value":"0.01"},{"type":"STAT","entity":"SELF","basis":"BONUS","stat":"MANA"}]},"status_or_stat":"AP_FLAT"}]},{"id":"archangels_variant_manaflow","source_label":"PASSIVE:Manaflow","kind":"PASSIVE","trigger":"ABILITY_HIT","required_context_flag":"MANAFLOW_CHARGE_AVAILABLE","operations":[{"kind":"GRANT_STAT","target":"SELF","value_expression":{"type":"CONSTANT","value":"9.5"},"context_multiplier":"MANAFLOW_TARGET_MULTIPLIER","status_or_stat":"MAX_MANA_FLAT"}]},{"id":"archangels_variant_transform","source_label":"PASSIVE:Manaflow","kind":"PASSIVE","trigger":"ABILITY_HIT","required_context_flag":"MANAFLOW_REACHED_360","operations":[{"kind":"TRANSFORM_ITEM","target":"SELF","value_expression":{"type":"CONSTANT","value":"323040"},"status_or_stat":"SERAPHS_EMBRACE"}]}],"verification":{"status":"CURATED_UNVERIFIED","source_refs":["data/raw/16.17.1/en_US/item.json#/data/323003","data/raw/16.17.1/communitydragon/items.cdtb.bin.json#/Items~1/323003"]}}
