{
  "schema_version": "1.0.0", "item_id": 3110, "patch_version": "16.17.1",
  "programs": [{
    "id": "frozen_heart_winters_caress",
    "source_label": "PASSIVE:Winter's Caress",
    "kind": "PASSIVE", "trigger": "ALWAYS",
    "operations": [{
      "kind": "GRANT_STAT", "target": "NEARBY_ENEMIES",
      "value_expression": {"type": "CONSTANT", "value": "0.20"},
      "status_or_stat": "ATTACK_SPEED_REDUCTION_PERCENT"
    }]
  }],
  "verification": {"status": "CURATED_UNVERIFIED", "source_refs": [
    "data/raw/16.17.1/en_US/item.json#/data/3110",
    "data/raw/16.17.1/communitydragon/items.cdtb.bin.json#/Items~1/3110"
  ]}
}
