{"schema_version":"1.0.0","item_id":3363,"patch_version":"16.17.1","programs":[{"id":"farsight_alteration_active","source_label":"ACTIVE:Active","kind":"ACTIVE","trigger":"ITEM_ACTIVE_USED","operations":[{"kind":"REVEAL_AREA","target":"SELF","value_expression":{"type":"CONSTANT","value":"2"},"status_or_stat":"DISTANT_AREA_SECONDS"},{"kind":"PLACE_WARD","target":"SELF","value_expression":{"type":"CONSTANT","value":"500"},"status_or_stat":"FARSIGHT_WARD_VISION_RADIUS"}]}],"verification":{"status":"CURATED_UNVERIFIED","source_refs":["data/raw/16.17.1/en_US/item.json#/data/3363","data/raw/16.17.1/communitydragon/items.cdtb.bin.json#/Items~1/3363"]}}
