{"schema_version":"1.0.0","item_id":3340,"patch_version":"16.17.1","programs":[{"id":"stealth_ward_active","source_label":"ACTIVE:Active","kind":"ACTIVE","trigger":"ITEM_ACTIVE_USED","operations":[{"kind":"PLACE_WARD","target":"SELF","value_expression":{"type":"LEVEL_CURVE","level_entity":"SELF","values":["90","91.7647058823529411764705882","93.5294117647058823529411765","95.2941176470588235294117647","97.0588235294117647058823529","98.8235294117647058823529412","100.5882352941176470588235294","102.3529411764705882352941176","104.1176470588235294117647059","105.8823529411764705882352941","107.6470588235294117647058824","109.4117647058823529411764706","111.1764705882352941176470588","112.9411764705882352941176471","114.7058823529411764705882353","116.4705882352941176470588235","118.2352941176470588235294118","120"]},"status_or_stat":"STEALTH_WARD_DURATION_SECONDS"},{"kind":"MODIFY_STACKS","target":"SELF","value_expression":{"type":"CONSTANT","value":"-1"},"status_or_stat":"TRINKET_CHARGES_MAX_2"}]}],"verification":{"status":"CURATED_UNVERIFIED","source_refs":["data/raw/16.17.1/en_US/item.json#/data/3340","data/raw/16.17.1/communitydragon/items.cdtb.bin.json#/Items~1/3340"]}}
