{"schema_version":"1.0.0","item_id":324005,"patch_version":"16.17.1","programs":[{"id":"mandate_variant_control","source_label":"PASSIVE:Control","kind":"PASSIVE","trigger":"ALWAYS","operations":[{"kind":"GRANT_STAT","target":"SELF","value_expression":{"type":"CONSTANT","value":"20"},"status_or_stat":"IMMOBILIZING_ABILITY_HASTE"}]},{"id":"mandate_variant_command","source_label":"PASSIVE:Command","kind":"PASSIVE","trigger":"IMMOBILIZE_CHAMPION","operations":[{"kind":"GRANT_STAT","target":"TARGET","value_expression":{"type":"CONSTANT","value":"0.07"},"duration_ms":4000,"status_or_stat":"DAMAGE_TAKEN_INCREASE_PERCENT"}]}],"verification":{"status":"CURATED_UNVERIFIED","source_refs":["data/raw/16.17.1/en_US/item.json#/data/324005","data/raw/16.17.1/communitydragon/items.cdtb.bin.json#/Items~1/324005"]}}
