{"schema_version":"1.0.0","item_id":8010,"patch_version":"16.17.1","programs":[{"id":"bloodletters_vile_decay","source_label":"PASSIVE:Vile Decay","kind":"PASSIVE","trigger":"MAGIC_DAMAGE_TO_CHAMPION","cooldown_ms":300,"stacking":{"max_stacks":4,"stacks_per_trigger":1,"duration_ms":6000},"operations":[{"kind":"GRANT_STAT","target":"TARGET","status_or_stat":"MAGIC_RESISTANCE_REDUCTION_PERCENT","duration_ms":6000,"multiply_by_current_stacks":true,"value_expression":{"type":"CONSTANT","value":"0.075"}}]}],"verification":{"status":"CURATED_UNVERIFIED","source_refs":["data/raw/16.17.1/en_US/item.json#/data/8010","data/raw/16.17.1/communitydragon/items.cdtb.bin.json#/Items~1/8010"]}}
