{
  "schema_version": "1.0.0", "item_id": 6662, "patch_version": "16.17.1",
  "programs": [{
    "id": "iceborn_spellblade", "source_label": "PASSIVE:Spellblade", "kind": "PASSIVE",
    "trigger": "BASIC_ATTACK_HIT", "required_context_flag": "SPELLBLADE_READY", "cooldown_ms": 1500,
    "operations": [
      {"kind": "DAMAGE", "target": "TARGET", "damage_type": "PHYSICAL", "value_expression": {"type": "MULTIPLY", "factors": [{"type": "CONSTANT", "value": "1.5"}, {"type": "STAT", "entity": "SELF", "basis": "BASE", "stat": "AD"}]}},
      {"kind": "APPLY_STATUS", "target": "AREA_ENEMIES", "status_or_stat": "CC_SLOW", "duration_ms": 2000, "range_multipliers": {"MELEE": "0.25", "RANGED": "0.125"}, "value_expression": {"type": "CONSTANT", "value": "1"}}
    ]
  }],
  "verification": {"status": "CURATED_UNVERIFIED", "source_refs": ["data/raw/16.17.1/en_US/item.json#/data/6662", "data/raw/16.17.1/communitydragon/items.cdtb.bin.json#/Items~1/6662"]}
}
