{"schema_version":"1.0.0","item_id":4401,"patch_version":"16.17.1","programs":[{"id":"force_nature_steadfast","source_label":"PASSIVE:Steadfast","kind":"PASSIVE","trigger":"MAGIC_DAMAGE_RECEIVED","proc_every":8,"counting_window_ms":7000,"operations":[{"kind":"GRANT_STAT","target":"SELF","status_or_stat":"MAGIC_RESISTANCE_FLAT","duration_ms":7000,"value_expression":{"type":"CONSTANT","value":"70"}},{"kind":"GRANT_STAT","target":"SELF","status_or_stat":"MOVE_SPEED_PERCENT","duration_ms":7000,"value_expression":{"type":"CONSTANT","value":"0.06"}}]}],"verification":{"status":"CURATED_UNVERIFIED","source_refs":["data/raw/16.17.1/en_US/item.json#/data/4401","data/raw/16.17.1/communitydragon/items.cdtb.bin.json#/Items~1/4401"]}}
