{"schema_version":"1.0.0","item_id":3085,"patch_version":"16.17.1","programs":[{"id":"runaans_winds_fury","source_label":"PASSIVE:Wind's Fury","kind":"PASSIVE","trigger":"BASIC_ATTACK_HIT","operations":[{"kind":"DAMAGE","target":"NEARBY_ENEMIES","damage_type":"PHYSICAL","multiply_by_targets_hit":true,"excludes_primary_target":true,"value_expression":{"type":"MULTIPLY","factors":[{"type":"CONSTANT","value":"0.40"},{"type":"STAT","entity":"SELF","basis":"TOTAL","stat":"AD"}]}},{"kind":"NO_OP","target":"NEARBY_ENEMIES","status_or_stat":"APPLY_ON_HIT_EFFECTS_TO_TWO_BOLTS","value_expression":{"type":"CONSTANT","value":"2"}}]}],"verification":{"status":"CURATED_UNVERIFIED","source_refs":["data/raw/16.17.1/en_US/item.json#/data/3085","data/raw/16.17.1/communitydragon/items.cdtb.bin.json#/Items~1/3085"]}}
