{"schema_version":"1.0.0","item_id":2512,"patch_version":"16.17.1","programs":[{"id":"fiendhunter_night_vigil","source_label":"PASSIVE:Night Vigil","kind":"PASSIVE","trigger":"ALWAYS","operations":[{"kind":"GRANT_STAT","target":"SELF","status_or_stat":"ULTIMATE_ABILITY_HASTE","value_expression":{"type":"CONSTANT","value":"30"}}]},{"id":"fiendhunter_opening_barrage","source_label":"PASSIVE:Opening Barrage","kind":"PASSIVE","trigger":"ULTIMATE_CAST","cooldown_ms":45000,"operations":[{"kind":"GRANT_STAT","target":"SELF","status_or_stat":"ATTACK_SPEED_PERCENT","duration_ms":8000,"value_expression":{"type":"CONSTANT","value":"0.50"}},{"kind":"APPLY_STATUS","target":"SELF","status_or_stat":"NEXT_3_ATTACKS_FORCED_CRIT_0_80_OR_0_15_BONUS_TRUE","duration_ms":8000,"value_expression":{"type":"CONSTANT","value":"3"}}]}],"verification":{"status":"CURATED_UNVERIFIED","source_refs":["data/raw/16.17.1/en_US/item.json#/data/2512","data/raw/16.17.1/communitydragon/items.cdtb.bin.json#/Items~1/2512"]}}
