{"schema_version":"1.0.0","item_id":2055,"patch_version":"16.17.1","programs":[{"id":"control_ward_consume","source_label":"ACTIVE:Consume","kind":"ACTIVE","trigger":"ITEM_ACTIVE_USED","operations":[{"kind":"PLACE_WARD","target":"SELF","value_expression":{"type":"CONSTANT","value":"1"},"status_or_stat":"CONTROL_WARD_VISION_REVEAL_CAMOUFLAGE"},{"kind":"TRANSFORM_ITEM","target":"SELF","value_expression":{"type":"CONSTANT","value":"1"},"status_or_stat":"CONSUME_ONE_CHARGE"}]}],"verification":{"status":"CURATED_UNVERIFIED","source_refs":["data/raw/16.17.1/en_US/item.json#/data/2055","data/raw/16.17.1/communitydragon/items.cdtb.bin.json#/Items~1/2055"]}}
