{"schema_version":"1.0.0","item_id":323004,"patch_version":"16.17.1","programs":[{"id":"manamune_variant_awe","source_label":"PASSIVE:Awe","kind":"PASSIVE","trigger":"ALWAYS","operations":[{"kind":"GRANT_STAT","target":"SELF","value_expression":{"type":"MULTIPLY","factors":[{"type":"CONSTANT","value":"0.02"},{"type":"STAT","entity":"SELF","basis":"MAX","stat":"MANA"}]},"status_or_stat":"AD_FLAT"}]},{"id":"manamune_variant_manaflow","source_label":"PASSIVE:Manaflow","kind":"PASSIVE","trigger":"ATTACK_OR_ABILITY_HIT","required_context_flag":"MANAFLOW_CHARGE_AVAILABLE","operations":[{"kind":"GRANT_STAT","target":"SELF","value_expression":{"type":"CONSTANT","value":"6.5"},"context_multiplier":"MANAFLOW_TARGET_MULTIPLIER","status_or_stat":"MAX_MANA_FLAT"}]},{"id":"manamune_variant_transform","source_label":"PASSIVE:Manaflow","kind":"PASSIVE","trigger":"ATTACK_OR_ABILITY_HIT","required_context_flag":"MANAFLOW_REACHED_360","operations":[{"kind":"TRANSFORM_ITEM","target":"SELF","value_expression":{"type":"CONSTANT","value":"323042"},"status_or_stat":"MURAMANA"}]}],"verification":{"status":"CURATED_UNVERIFIED","source_refs":["data/raw/16.17.1/en_US/item.json#/data/323004","data/raw/16.17.1/communitydragon/items.cdtb.bin.json#/Items~1/323004"]}}
