{"schema_version":"1.0.0","item_id":663039,"patch_version":"16.17.1","programs":[{"id":"atmas_reckoning_big_hands","source_label":"PASSIVE:Big Hands","kind":"PASSIVE","trigger":"ALWAYS","operations":[{"kind":"GRANT_STAT","target":"SELF","value_expression":{"type":"CONSTANT","value":"0.0001"},"context_multiplier":"BONUS_HP_CAPPED_AT_3000","status_or_stat":"CRIT_CHANCE_FLAT"}]}],"verification":{"status":"CURATED_UNVERIFIED","source_refs":["data/raw/16.17.1/en_US/item.json#/data/663039","data/raw/16.17.1/communitydragon/items.cdtb.bin.json#/Items~1/663039"]}}
