{
  "schema_version": "1.0.0", "item_id": 3026, "patch_version": "16.17.1",
  "programs": [{
    "id": "guardian_angel_rebirth", "source_label": "PASSIVE:Rebirth",
    "kind": "PASSIVE", "trigger": "LETHAL_DAMAGE_TAKEN", "cooldown_ms": 300000,
    "operations": [
      {
        "kind": "APPLY_STATUS", "target": "SELF",
        "value_expression": {"type": "CONSTANT", "value": "1"},
        "duration_ms": 4000, "status_or_stat": "STASIS"
      },
      {
        "kind": "REVIVE", "target": "SELF", "delay_ms": 4000,
        "value_expression": {"type": "MULTIPLY", "factors": [
          {"type": "CONSTANT", "value": "0.5"},
          {"type": "STAT", "entity": "SELF", "basis": "BASE", "stat": "HP"}
        ]},
        "status_or_stat": "HEALTH"
      },
      {
        "kind": "RESTORE_RESOURCE", "target": "SELF", "delay_ms": 4000,
        "value_expression": {"type": "STAT", "entity": "SELF", "basis": "MAX", "stat": "MANA"},
        "status_or_stat": "MANA"
      }
    ]
  }],
  "verification": {"status": "CURATED_UNVERIFIED", "source_refs": [
    "data/raw/16.17.1/en_US/item.json#/data/3026",
    "data/raw/16.17.1/communitydragon/items.cdtb.bin.json#/Items~1/3026"
  ]}
}
