{"schema_version":"1.0.0","item_id":3137,"patch_version":"16.17.1","programs":[{"id":"cryptbloom_life_from_death","source_label":"PASSIVE:Life from Death","kind":"PASSIVE","trigger":"CHAMPION_TAKEDOWN","cooldown_ms":60000,"operations":[{"kind":"HEAL","target":"AREA_ALLIES","value_expression":{"type":"ADD","terms":[{"type":"CONSTANT","value":"100"},{"type":"MULTIPLY","factors":[{"type":"CONSTANT","value":"0.20"},{"type":"STAT","entity":"SELF","basis":"TOTAL","stat":"AP"}]}]}}]}],"verification":{"status":"CURATED_UNVERIFIED","source_refs":["data/raw/16.17.1/en_US/item.json#/data/3137","data/raw/16.17.1/communitydragon/items.cdtb.bin.json#/Items~1/3137"]}}
