{
  "schema_version": "1.0.0", "item_id": 3044, "patch_version": "16.17.1",
  "programs": [{
    "id": "phage_rage", "source_label": "PASSIVE:Rage",
    "kind": "PASSIVE", "trigger": "BASIC_ATTACK_HIT",
    "operations": [{
      "kind": "GRANT_STAT", "target": "SELF",
      "value_expression": {"type": "CONSTANT", "value": "20"},
      "duration_ms": 2000, "status_or_stat": "MOVE_SPEED_FLAT",
      "range_multipliers": {"MELEE": "1", "RANGED": "0.5"}
    }]
  }],
  "verification": {"status": "CURATED_UNVERIFIED", "source_refs": [
    "data/raw/16.17.1/en_US/item.json#/data/3044",
    "data/raw/16.17.1/communitydragon/items.cdtb.bin.json#/Items~1/3044"
  ]}
}
