{"schema_version":"1.0.0","item_id":3803,"patch_version":"16.17.1","programs":[{"id":"catalyst_eternity_mana","source_label":"PASSIVE:Eternity","kind":"PASSIVE","trigger":"CHAMPION_DAMAGE_RECEIVED","operations":[{"kind":"RESTORE_RESOURCE","target":"SELF","value_expression":{"type":"CONSTANT","value":"0.10"},"context_multiplier":"DAMAGE_TAKEN_AMOUNT","status_or_stat":"MANA"}]},{"id":"catalyst_eternity_heal","source_label":"PASSIVE:Eternity","kind":"PASSIVE","trigger":"ABILITY_CAST_WITH_MANA_COST","operations":[{"kind":"HEAL","target":"SELF","value_expression":{"type":"CONSTANT","value":"0.25"},"context_multiplier":"MANA_SPENT_CAPPED_AT_80"}]}],"verification":{"status":"CURATED_UNVERIFIED","source_refs":["data/raw/16.17.1/en_US/item.json#/data/3803","data/raw/16.17.1/communitydragon/items.cdtb.bin.json#/Items~1/3803"]}}
